{"evidenceRefs": [{"kind": "validation_replay_id", "ref": "valreplay-001"}, {"kind": "validation_baseline_id", "ref": "valbase-001"}, {"kind": "validation_candidate_run_id", "ref": "valrun-0002"}], "gate": {"baselineDecision": "pass", "baselineId": "valbase-001", "candidateDecision": "pass", "candidateRunId": "valrun-0002", "decision": "pass", "id": "valreplay-001", "mergeBlocked": false, "mergeGateStatus": "pass", "metricDriftDeltaPct": 0.0, "metricDriftThresholdPct": 1.0, "reasons": [], "releaseBlocked": false, "releaseGateStatus": "pass", "status": "completed", "summary": "Replay comparison passed without regression.", "thresholdBreached": false}, "gateStatus": "pass", "generatedAt": "2026-02-20T19:16:14.785654Z", "schemaVersion": "validation-replay-gate-report.v1"}
